{
  "schema_version": "release-encryption-evidence.v1",
  "bundle_id": "bundle-example-0001",
  "sequence": 41,
  "nonce": "0123456789abcdef0123456789abcdef",
  "issued_at": "2026-07-11T12:01:00Z",
  "expires_at": "2026-07-11T12:06:00Z",
  "subject": {
    "tenant_id": "tenant-example",
    "environment": "production",
    "release_id": "release-2026-07-11",
    "deployment_revision": 42,
    "deployment_sha256": "5555555555555555555555555555555555555555555555555555555555555555",
    "encryption_policy_sha256": "bbbbbbbbbbbbbbbbbbbbbbbbbbbbbbbbbbbbbbbbbbbbbbbbbbbbbbbbbbbbbbbb",
    "evidence_schema_sha256": "6666666666666666666666666666666666666666666666666666666666666666",
    "trust_store_sha256": "cccccccccccccccccccccccccccccccccccccccccccccccccccccccccccccccc"
  },
  "provenance": {
    "issuer": "release-attestor.example.invalid",
    "builder_id": "builder.example.invalid/hallu-defense",
    "workflow_ref": "release.yml@refs/heads/main",
    "source_repository": "https://example.invalid/hallu-defense",
    "source_commit": "aaaaaaaaaaaaaaaaaaaaaaaaaaaaaaaaaaaaaaaa",
    "invocation_id": "invocation-example-0001",
    "started_at": "2026-07-11T11:59:00Z",
    "finished_at": "2026-07-11T12:00:30Z",
    "materials": [
      {
        "uri": "deployment-subject",
        "sha256": "5555555555555555555555555555555555555555555555555555555555555555"
      },
      {
        "uri": "artifact:api",
        "sha256": "dddddddddddddddddddddddddddddddddddddddddddddddddddddddddddddddd"
      },
      {
        "uri": "attestation:encryption.at-rest",
        "sha256": "7777777777777777777777777777777777777777777777777777777777777777"
      },
      {
        "uri": "attestation:encryption.in-transit",
        "sha256": "8888888888888888888888888888888888888888888888888888888888888888"
      },
      {
        "uri": "postgres-ca-rollout",
        "sha256": "ffffffffffffffffffffffffffffffffffffffffffffffffffffffffffffffff"
      }
    ]
  },
  "attestations": [
    {
      "control": "encryption.at-rest",
      "result": "pass",
      "subject_sha256": "5555555555555555555555555555555555555555555555555555555555555555",
      "observed_at": "2026-07-11T12:00:45Z",
      "claims": {
        "persistent_resources_verified": 4,
        "resource_ids": ["api", "minio", "postgres", "redis"],
        "unencrypted_persistent_resources": 0,
        "algorithms": ["AES-256-GCM"],
        "kms_authority_ids": ["vault://example/transit/release"],
        "deployment_hash_observed": true,
        "evidence_sha256": "7777777777777777777777777777777777777777777777777777777777777777"
      }
    },
    {
      "control": "encryption.in-transit",
      "result": "pass",
      "subject_sha256": "5555555555555555555555555555555555555555555555555555555555555555",
      "observed_at": "2026-07-11T12:00:50Z",
      "claims": {
        "external_endpoints_verified": 3,
        "endpoint_ids": ["api", "minio", "postgres"],
        "plaintext_external_endpoints": 0,
        "minimum_tls_version": "1.3",
        "trust_chain_validated": true,
        "peer_ca_sha256": [
          "1111111111111111111111111111111111111111111111111111111111111111"
        ],
        "deployment_hash_observed": true,
        "evidence_sha256": "8888888888888888888888888888888888888888888888888888888888888888"
      }
    }
  ],
  "rotation": {
    "epoch": 7,
    "phase": "stable"
  },
  "commitments": [
    {
      "algorithm": "hmac-sha256",
      "key_id": "commit-epoch-7",
      "value": "9999999999999999999999999999999999999999999999999999999999999999"
    }
  ],
  "authenticators": [
    {
      "algorithm": "ed25519",
      "key_id": "auth-epoch-7",
      "value": "AAAAAAAAAAAAAAAAAAAAAAAAAAAAAAAAAAAAAAAAAAAAAAAAAAAAAAAAAAAAAAAAAAAAAAAAAAAAAAAAAAAAAA=="
    }
  ]
}
